{
  "type": "authority-scope",
  "gaamVersion": "0.9.0",
  "status": "experimental",
  "normativeStatus": "non-normative",
  "actions": [
    "issue"
  ],
  "objects": [
    "credential:class:a"
  ],
  "purpose": [
    "participant-onboarding"
  ],
  "validFrom": "2026-07-29T00:00:00Z",
  "validUntil": "2027-07-29T00:00:00Z"
}
